title,name,category,material,brand,description,url,img_url,biodegradable,recyclable,low_waste,eco_packaging,low_carbon,renewable
"Chloven 30 Pack Reusable Makeup Remover Pads - Bamboo Cotton Rounds for Toner, Washable, Eco-Friendly for All Skin Types with Cotton Laundry Bag",Cotton Pads & Rounds,Beauty & Personal Care,Bamboo charcoal fiber & Cotton,Chloven,"bamboo Terry scrub makeup remover pads > Imported30 Pack Bundle Includes Three TYPES OF PADSThe set includes 10 bamboo Terry scrub & 10 bamboo soft cotton organic pads & 10 bamboo charcoal makeup remover pads.The scrub bamboo makeup remover pads are perfect for cleaning off tenacious products and exfoliating the skin. The soft cotton rounds pads are great for removing make up regularly and for areas like the eyes. These Eco-Friendly Products Zero Waste Sustainable Cloths Organic makeup remover pads are all you needEarth FRIENDLY & No WASTE These soft charcoal bamboo pads are perfect for removing makeup, saving you money and reducing waste; you will never have to purchase one-use cleanser pads again. One charcoal bamboo pad can replace thousands of disposable cotton rounds. One pad can be used over 1000 times! Our packaging is completely recyclable, will not cause a lot of garbage pollutionGREAT ORGANIC CLEAN ALTERNATIVEThe Cotton rounds reusable pads 100% remove your makeup away with some cleanser or toner, it is recommended to add some warm water to wet this remover pads gently removing makeup pads in a circular motion, and flipping cloth over and over until all makeup is removed and it will leave your face clean, soft smooth and fresh right away. It can be reusable and washed by machine. come on! Let's be an environmentalist together",https://www.amazon.com/dp/B087PW8WS9,https://m.media-amazon.com/images/I/516j1CVhcML.__AC_SX300_SY300_QL70_ML2_.jpg,0,1,1,0,1,1
Miztag Home & Health Conditioner Bar - Solid Natural Soap for Hair - Vegan Zero Waste Packaging - Chamomile Scent - Eco-Friendly Gift for Women,Soaps,Beauty & Personal Care,Vegan,Miztag Home & Health,"Essential Oils with great scent - Essential Oils like Chamomile that effectively Conditions and gives your hair a clean, lush shiny look. Our bars help eliminate or reduce dandruff and restore dull hair strands.Only Natural Ingredients - Essential oils like Roman Chamomile to nourish and cleanse. Our bars help eliminate or reduce dandruff and restore dull hair strands. Natural ingredients heal split ends. No harmful or animal laden additives Zero Waste - Perfect Sustainable Gifts - Let's save the planet together! Once the bar is used, all that remains is the biodegradable soap wrapper. Absolutely no waste, unlike plastic bottles. Great for the environment & provides same results as rice water conditioner barSuperior Clean, Lush, Shiny Hair - Perfect for everyday use. Deeply cleanses & moisturizes without detergents or harsh chemicals. Only quality ingredients to keep your hair looking healthy and beautiful. Excellent for women, men & children. Premium Quality - Our bars are concentrated, so they last longer and prove more cost effective than bottles of shampoo. Great for all hair types. Enjoy the new look and feel of your soft, shiny, sensational hair with MizTag eco-friendly shampoo bars and conditioner",https://www.amazon.com/dp/B0968CJLMH,https://m.media-amazon.com/images/I/41jAH0UhxDL._SX300_SY300_QL70_ML2_.jpg,1,0,1,0,0,1
"Biodegradable Silk Dental Floss with Refillable Glass Container, Compostable 3-Pack, Natural Silk Spool Eco-Friendly Zero Waste Oral Care, Mint Flavored",Dental Floss,Health & Household,Floss,Hemli Home,"Silk Floss for Effective Cleaning  Gently yet effectively cleans between teeth, providing a thorough dental care routine without compromising your values. > Refillable Glass Container  Durable and eco-conscious glass container designed for easy floss replacement, reducing waste with every refill. > 99 Yards of Floss Included  Comes with 3 spools, each offering 33 yards of premium silk floss for extended use and lasting convenience. > PFAS-Free and BPA-Free  Made without harmful chemicals for a safe and worry-free experience for you and your family. > Plastic-Free Design  Thoughtfully crafted to minimize environmental impact, offering a sustainable alternative to traditional floss.",https://www.amazon.com/dp/B0DDZRY34Y,https://m.media-amazon.com/images/I/818hNAf0RkL.__AC_SX300_SY300_QL70_ML2_.jpg,1,0,1,0,0,1
"Reusable Beeswax Wrap - 9 Pack Beeswax Wraps for Food, Eco-Friendly Beeswax Food Wraps, Bread Sandwich Wrapper - Organic, Sustainable, Zero Waste, Reusable Plastic-Free Food Storage Wrap, 1XL, 3M, 5S",Plastic Wrap,Health & Household,"5*Small, 3*Medium, 1*X-Large",BYTTME,"NATURAL ECO-FRIENDLY INGREDIENTS Our Reusable Beeswax Wrap are made from Organic cotton, Organic jojoba oil, Natural Harvest beeswax, and Tree resin. These beeswax wraps are all certified with European LFGB, the fabric is GOTS certified(Global Organic Textile Standard) and the packaging is made from 100% recycled paper. Reusable beeswax food wrap is sustainable and a natural alternative to plastic wraps and cling film for food!MULTIPLE SIZES FOR A SET This set come with 9 Packs Beeswax Wrap for your daily uses: 1 X-Large(14.3x14.3""), 3 Medium(11.5x11.5"") and 5 Small(7.5x7.5"") beeswax wraps. Different sizes can cover different foods or bowls depending on your demand. It's great to wrap food leftovers or food you take to the picnic, your office sandwich, in kids lunchboxes or to store well for your fresh produce, fruits, snacks, cheese, bread, sandwiches, nuts and more!KEEP FOOD FRESHER FOR LONGER Unique self-adhesive design & double coating make our beeswax wrap more durable and long lasting. Our reusable food wraps with beeswax are not only environmentally friendly and highly sustainable it also makes sure your food stays fresher for longer. Beeswax wraps for food can create air tight seals which will keep your food fresh and delightful. Now you can keep your fruits, vegetables, sandwich, cheese and leftovers wrapped up and maintain flavor of your food.REUSABLE & WASHABLE Use the warmth of your hands to soften the beeswax wrap and form over a container or foods. Wash in cool water with mild soap and air dry then use again. Our high grade beeswax food wraps will last up to a year with regular use. Keep food wraps away from heat and don't put in the dishwasher. Our reusable food wrap is biodegradable, sustainable and washable. Say goodbye to plastic wrap and cling wrap, and it's a great addition in your eco-friendly kitchen items.GREEN LIFE It's never too late to promote a plastic-free life with these Eco-Friendly reusable beeswax wrap. The reusable food wraps is a sustainable product that is good in quality and easy to use, also fine for the environment. Ideal for an organic lifestyle and a healthy food lifestyle. Also its a good gift for your family or friends to protect our earth!",https://www.amazon.com/dp/B0CSWTNWD6,https://m.media-amazon.com/images/I/91WLU-vPkzL.__AC_SX300_SY300_QL70_ML2_.jpg,1,1,1,0,0,1
"AKT, THE ASSISTANT. Tube squeezer key  The key to ZERO WASTE. 100% PLASTIC FREE & RECYCLABLE  Squeeze out every last drop of your NATURAL DEODORANT BALM",Deodorant,Beauty & Personal Care,Unscented,Akt,"THE KEY TO ZERO WASTE: Unlock your senses and maximise the efficacy of your AKT. This clever, covetable tool will keep you dry until the very last drop  and adorn your shelf like no other accessory has before.  100% PLASTIC FREE: Enter The Assistant, coming to the rescue in shining, plastic-free armour. HOW TO AKT: Simply position The Assistant over the crimped end of The Deodorant Balm. Gently turn the head to dispense the perfect amount of The Deodorant Balm onto your finger or The Applicator. Leave The Assistant fixed in place for your next application. > SUSTAINABLE SOLUTION: ensuring absolutely nothing goes to waste. Your skin is happy. Mother Earth is even happier. Confidence is key. Getting the most out of your AKT is the secret. Quiet on set... were rolling.",https://www.amazon.com/dp/B0BG5DL8VX,https://m.media-amazon.com/images/I/218o0b7nspL._SX300_SY300_QL70_ML2_.jpg,0,1,1,0,1,1
100% Certified Home Compostable Dog Poop Bags - 10% to Charity - ASTM D6400 & EN 13432 Compliant - 120 x Plant Based Compostable Poop Bags (8 Rolls),Bags,Pet Supplies,120.0 Count,G.A.S,"100% HOME COMPOSTABLE DOG POOP BAGS - Our unscented poop bags for dogs are ethically sourced and carefully manufactured from 100% botanical plant components. We use only Cornstarch, BPAT (compostable polymer), and edible glycerin in the nature-based creation of our doggie poop bags. All our products are TÃœV AUSTRIA Home Compost Certified to be of ASTM D6400, EN 13432 and NF T51-800 standards! > EASY TO OPEN AND EASY TO TEAR - Other eco friendly dog bag on the market seem to be a nightmare to open and so hard to tear! Why does being environmental and eco friendly have to be so hard. Our compostable doggie poop bags are an absolute breeze to open and tear apart even in the wettest of conditions! > LEAKPROOF, ODORLESS AND FITS ALL DISPENSERS - Let's face it, dog poop smells like...well, you know. Minimize the Ew! factor so you can relax and enjoy all of the sights (and smells) on walks with your furry best friend. Our doggie bags for poop are engineered to a durable 18 micron thickness that locks away odors and guarantees a mess-free leakproof seal. Our rolls are the perfect dog poop bags refills as they fit all dispensers! > CRAFTED FROM RECYCLED MATERIALS - Our dog bags are a zero-waste green alternative that will change the way you look at everyday pet and dog supplies. Not only are our compostable poop bags fully compostable but they also come in a box and reel made from 100% recycled cardboard. > GIVING BACK TO OUR ANIMAL FRIENDS - We are big believers in the power of charity to not only transform the lives of other beings, but to transform our own. We've partnered with the Soi Dog Foundation, whose mission is to improve the lives of dogs and cats in Asia. We donate 10% of all profits to the Soi Dog Foundation and their tireless quest to end animal suffering when you buy our compostable dog bags for poop and other sustainable products / zero waste products.",https://www.amazon.com/dp/B07N52NLC3,https://m.media-amazon.com/images/I/81LFHXu5dML.__AC_SX300_SY300_QL70_ML2_.jpg,1,1,1,1,0,1
"Akeeko Reusable Beeswax Food Wraps - Assorted 9 Packs, Eco-Friendly Reusable Wrap, Biodegradable, Zero Waste, Organic Cloth, Sustainable, Plastic-Free Food Storage, 1Large, 3Medium, 5Small Sizes",Plastic Wrap,Health & Household,"Small, Medium, Large",Akeeko,"ECO-FRIENDLY NATURAL INGREDIENTS: Our food wraps s are made from organic cotton, organic jojoba oil, ethically harvest beeswax, and tree resin. These wraps are all certified with European LFGB. The fabric is GOTS certified (Global Organic Textile Standard), and even for packaging it is made of 100% recycled paper. A natural alternative to plastic wraps and cling film! ONE SIZE DOES NOT FIT ALL: Size and Quantity would matter! Our design is triple than the popular quantity and sizes for your daily uses. 9-PACK includes 5 Small (7"" x 8""), and 3 Medium (10"" x 11""), and 1 Large (13"" x 14"") wraps. Different sizes can cover different foods depending on your demand. EASY TO WASH, REUSABLE, COMPOSTABLE : Use the warmth of your hands to soften the wrap and form over a container or piece of food. Wash in cool water with mild soap and air dry. Keep food wraps s away from heat and dont put them in the dryer. The properties of beeswax and jojoba oil help keep food fresher and allow food wraps to be used again and again.  FOOD STAYS FRESHER FOR LONGER: Our premium reusable food wraps with beeswax are not only environmentally friendly and highly sustainable it also makes sure your food stays fresher for longer. Our food wraps s can create air tight seals which will keep your food fresh and delightful. Now you can keep your sandwich, cheese, fruit and leftovers wrapped up and maintain flavor of your food.  TRY OUR WRAPS RISK FREE  If for ANY reason you aren completely satisfied with these wraps, please let us know and we will refund or replace your purchase! Simply contact us by clicking on the â€œAkeeko4Planetâ€ store and then click on ask a question.",https://www.amazon.com/dp/B092CBDKWG,https://m.media-amazon.com/images/I/91UpDUvsk-L.__AC_SX300_SY300_QL70_ML2_.jpg,1,1,1,0,0,1
"Reusable Beeswax Wrap - 9 Pack Beeswax Wraps for Food, Eco-Friendly Beeswax Food Wraps, Bread Sandwich Wrapper - Organic, Sustainable, Zero Waste, Reusable Plastic-Free Food Storage Wrap, 1XL, 3M, 5S",Plastic Wrap,Health & Household,"5*Small, 3*Medium, 1*X-Large",BYTTME,"NATURAL ECO-FRIENDLY INGREDIENTS Our Reusable Beeswax Wrap are made from Organic cotton, Organic jojoba oil, Natural Harvest beeswax, and Tree resin. These beeswax wraps are all certified with European LFGB, the fabric is GOTS certified(Global Organic Textile Standard) and the packaging is made from 100% recycled paper. Reusable beeswax food wrap is sustainable and a natural alternative to plastic wraps and cling film for food!MULTIPLE SIZES FOR A SET This set come with 9 Packs Beeswax Wrap for your daily uses: 1 X-Large(14.3x14.3""), 3 Medium(11.5x11.5"") and 5 Small(7.5x7.5"") beeswax wraps. Different sizes can cover different foods or bowls depending on your demand. It's great to wrap food leftovers or food you take to the picnic, your office sandwich, in kids lunchboxes or to store well for your fresh produce, fruits, snacks, cheese, bread, sandwiches, nuts and more!KEEP FOOD FRESHER FOR LONGER Unique self-adhesive design & double coating make our beeswax wrap more durable and long lasting. Our reusable food wraps with beeswax are not only environmentally friendly and highly sustainable it also makes sure your food stays fresher for longer. Beeswax wraps for food can create air tight seals which will keep your food fresh and delightful. Now you can keep your fruits, vegetables, sandwich, cheese and leftovers wrapped up and maintain flavor of your food.REUSABLE & WASHABLE Use the warmth of your hands to soften the beeswax wrap and form over a container or foods. Wash in cool water with mild soap and air dry then use again. Our high grade beeswax food wraps will last up to a year with regular use. Keep food wraps away from heat and don't put in the dishwasher. Our reusable food wrap is biodegradable, sustainable and washable. Say goodbye to plastic wrap and cling wrap, and it's a great addition in your eco-friendly kitchen items.GREEN LIFE It's never too late to promote a plastic-free life with these Eco-Friendly reusable beeswax wrap. The reusable food wraps is a sustainable product that is good in quality and easy to use, also fine for the environment. Ideal for an organic lifestyle and a healthy food lifestyle. Also its a good gift for your family or friends to protect our earth!",https://www.amazon.com/dp/B0CSYK47SB,https://m.media-amazon.com/images/I/71590ocFAPL.__AC_SX300_SY300_QL70_ML2_.jpg,1,1,1,0,0,1
"EZ Disposable Razor - 50pcs Eco Friendly Disposable Three Blade Shaving Razor for Men/Women's Grooming, Biodegradable Single-Use Body & Face Shaver for Eco Friendly Product Gifts",Disposable Razors,Beauty & Personal Care,1.00 Count,EZTAT2,"Close, Smooth Shaving Our blades are curved, slim, and flexible, engineered for a close, comfortable shave with minimal irritation.Perfect ShaveThis shaver makes your legs silky smooth! After shaving, you cannot stop touching them. They stay for a long time after shaving, and they are still very smooth after a few days! After use, you need to clean and dry all parts of the razor to keep it clean, so as not to hurt yourself and rust the next time you use it.Easy To UseGently and painlessly remove excess hair, eyebrows and facial beards. Each razor is non-slip, easy to grip, and sharp enough for precise control.the blade is very sharp,allowing you to shave smoothly on your face.Professional RazorsThree blade razor head for an even and close shave.Save money on shaving while taking care of the environment.Beginner FriendlyOur razors have a very simple design and blade replacement is very easy. With its unigue texturedgrip and comfortable weight.",https://www.amazon.com/dp/B09P61N2NZ,https://m.media-amazon.com/images/I/41xmz0RrDrL._SX300_SY300_QL70_ML2_.jpg,1,0,0,1,1,0
100% Certified Home Compostable Dog Poop Bags - 10% to Charity - ASTM D6400 & EN 13432 Compliant - 240 x Plant Based Compostable Poop Bags (16 Rolls),Bags,Pet Supplies,240 Count,G.A.S,"100% HOME COMPOSTABLE DOG POOP BAGS - Our unscented poop bags for dogs are ethically sourced and carefully manufactured from 100% botanical plant components. We use only Cornstarch, BPAT (compostable polymer), and edible glycerin in the nature-based creation of our doggie poop bags. All our products are TÃœV AUSTRIA Home Compost Certified to be of ASTM D6400, EN 13432 and NF T51-800 standards! > EASY TO OPEN AND EASY TO TEAR - Other eco friendly dog bag on the market seem to be a nightmare to open and so hard to tear! Why does being environmental and eco friendly have to be so hard. Our compostable doggie poop bags are an absolute breeze to open and tear apart even in the wettest of conditions! > LEAKPROOF, ODORLESS AND FITS ALL DISPENSERS - Let's face it, dog poop smells like...well, you know. Minimize the Ew! factor so you can relax and enjoy all of the sights (and smells) on walks with your furry best friend. Our doggie bags for poop are engineered to a durable 18 micron thickness that locks away odors and guarantees a mess-free leakproof seal. Our rolls are the perfect dog poop bags refills as they fit all dispensers! > CRAFTED FROM RECYCLED MATERIALS - Our dog bags are a zero-waste green alternative that will change the way you look at everyday pet and dog supplies. Not only are our compostable poop bags fully compostable but they also come in a box and reel made from 100% recycled cardboard. > GIVING BACK TO OUR ANIMAL FRIENDS - We are big believers in the power of charity to not only transform the lives of other beings, but to transform our own. We've partnered with the Soi Dog Foundation, whose mission is to improve the lives of dogs and cats in Asia. We donate 10% of all profits to the Soi Dog Foundation and their tireless quest to end animal suffering when you buy our compostable dog bags for poop and other sustainable products / zero waste products.",https://www.amazon.com/dp/B08GKBWFGZ,https://m.media-amazon.com/images/I/81tojHkX5TL.__AC_SX300_SY300_QL70_ML2_.jpg,1,1,1,0,1,1
"Bottle Brush Set - Ergonomic & Plastic Free Bamboo Bottle Brush, All in One Bottle And Straw Brush Cleaning Set, Sturdy Eco Friendly Water Bottle Cleaner Brush Set, Great Baby Bottle Cleaner Brush Set",Bottle Brushes,Baby Products,"Bamboo,Wood",Linea Gear,"Bottle cleaning set in assorted sizes. Includes a Regular and a Smoothie Straw Cleaning Brush, an Ergonomic Bottle Brush, a Slim Water Bottle Cleaner Brush, and a Detail Cleaning Brush. Sustainable and durable for long-lasting scrubbing. > No Microplastics & Plant Based - Bottle Cleaning Brush Set made from natural or reusable materials A sustainable naturally non-scratch brush for every shape and size bottle, for an effortless low waste kitchen. > Extra-Strong & Ergonomic - Finished Bamboo, for extra protection against moisture. This water bottle cleaner brush set wont crack. Comfort is Key: We've got your grip covered! The ergonomic handle of our bottle brush keeps things comfy while you scrub away. > Make a Clean Start - This set includes all the tools you need to tackle tricky corners, caps and lids, sippy spouts, slim straws, and more. Linea Gears convenient Bottle Brush Cleaning Set for all of your cleaning issues! > Get More and Waste Less - Zero waste products in one package means convenience, less waste, and more savings. You save more on the grouped package than the individual items when purchased separately.",https://www.amazon.com/dp/B0B7521N73,https://m.media-amazon.com/images/I/71Pzz8uHomL.__AC_SX300_SY300_QL70_ML2_.jpg,0,0,1,0,0,1
"ECOLULU Eco Friendly Toilet Brush, 2 Pack Wood Toilet Brush Made of Beechwood, Strong Hemp Bristles with 360Â° Cleaning Power, Biodegradable Zero Waste Eco Friendly Products",Toilet Brushes & Holders,Home & Kitchen,Wood,Ecolulu - Zero Waste Eco-friendly Products,"ECO FRIENDLY PRODUCTS, ZERO WASTE: Our wooden toilet brush is 100% natural, chemical free and biodegradable. Can be tossed into compost after they wear out. Packed in a recyclable box.ECO FRIENDLY: Eco friendly toilet brush made of beechwood and plant based sisal bristles. LONG HANDLE: 14' long wooden handle for easy cleaning of toilet bowl. EFFECTIVE & DURABLE: Powerful and durable sisal bristles with 360Â° cleaning power will effectively clean your toilet. By using this BIODEGRADABLE ECO FRIENDLY PRODUCTS you save the planet 2 plastic brushes! Well Done!!",https://www.amazon.com/dp/B08F2DY3R4,https://m.media-amazon.com/images/I/71GkuHA-VIL.__AC_SY300_SX300_QL70_ML2_.jpg,1,1,1,0,0,0
"Bamboo Cotton Swabs - 500 Count - FSC Certified and PETA Approved, Eco Friendly Double Tips, Plastic Free Ear Sticks, All Natural 100% Biodegradable Organic Cotton buds by Isshah",Cotton Swabs,Beauty & Personal Care,,Isshah,"SUSTAINABLE MATERIAL - Isshah cotton swabs are 100% biodegradable and made from sustainable bamboo. Perfect alternative to plastic cotton swabs which comes at the cost of harming our nature. It does not contain any dyes, chemicals or plastics. > NO MORE STRAIN ON THE ENVIRONMENT - Using these little plastic tip used to be a real treat, but they ended up being discarded here and there, clogging up sewers and ending up in our landfills. Made from bamboo and cotton, this small stick is as useful as its plastic counterpart but without any nastiness and also 100% biodegradable. > MULTI-PURPOSE - bamboo cotton swabs can be used in exact the same way a plastic cotton swab. They have a wide variety of uses including beauty, applying/removing/touching-up cosmetics, household cleaning, arts & crafts, pet care, baby care, and more! > RECYCLABLE CARDBOARD BOX - Our bamboo cotton buds come in a recyclable cardboard box. By purchasing this, you are helping to promote a plastic-free lifestyle. > PACK OF 500 - There are 500 bamboo cotton swabs in the box. buy a box of Isshah cotton swab can last a long time to use.",https://www.amazon.com/dp/B09DPYR67T,https://m.media-amazon.com/images/I/41ilEJ8WKnL._SX300_SY300_QL70_ML2_.jpg,1,1,0,0,0,1
"Disposable Face Towels | XL 50 Pack | 100% Biodegradable Fiber, Ultra Soft & Tear-Resistant | Eco-Friendly & Sustainable for Facial Care & Travel",Cloths & Towelettes,Beauty & Personal Care,Biodegradable,LAUCOT,"100% Biodegradable, Eco-Friendly Fiber: Made from sustainable, biodegradable materials, these disposable towels are perfect for responsible use, helping to reduce environmental impact. Extra Large Size (10""x12""): Larger and thicker for better coverage and maximum absorbency, ideal for makeup removal, face cleansing, or drying delicate skin. > âœ¨ Ultra Soft & Tear-Resistant: Designed to be gentle on sensitive skin, these towels provide a soft, luxurious feel while remaining durable and resistant to tearing. > ðŸ›¡ï¸ Perfect for Hygiene & Convenience: Single-use design ensures hygiene and is perfect for travel, daily skincare, or professional use. > ðŸŒ Sustainable & Recyclable Packaging: Environmentally friendly packaging that ensures sustainability from start to finish.",https://www.amazon.com/dp/B0DSPHGFRV,https://m.media-amazon.com/images/I/315Ab57SVsL._SX300_SY300_QL70_ML2_.jpg,1,1,0,0,0,1
Beauty and the Bees Eco Friendly Real Beer & Honey Solid Shampoo Bar for Oily - Normal to Oily Hair | Adds Body & Shine | 100% Natural & Organic Ingredients Sulfate Free,Shampoos,Beauty & Personal Care,"Oily, Dry, Curly, Fine, Normal",Beauty and the Bees,"Our Real Beer & Honey Shampoo Bar is a totally concentrated solid shampoo bar for natural hair care & shiny healthy hair! Great shampoo bar for men women children & babies > Made from 100% natural leatherwood honey & organic nourishing plant and essential oils - Nice ginger cinnamon scent > NEW CUBE SHAPE: A totally concentrated All Natural solid shampoo bar = 3 liquid shampoo bottles! Travel Friendly! Sulfate, silicone, paraben, plastic & cruelty free | Zero Waste - Eco Sustainable - Recycled packaging! > Beer has been famed for generations for its ability to leave hair bouncy, shiny and full of body, so this bar is chock a block with it _ brewed naturally by small breweries, locally in Tasmania Australia. Promotes healthy hair and scalp to moisturize and condition without heaviness/residue. Especially good for those with dandruff and with oily, fine, or thin hair. > Beauty & the Bees uses only premium quality and organic Australian ingredients found among the healthy gourmet foods you eat and drink. Ingredients include our island's unique raw, unpasteurized Leatherwood honey, certified organic olive oil, coconut oil, raw castor oil, Leatherwood beeswax, and certified organic and bio dynamic Tasmanian herbs. These fine and pure ingredients leave hair glossy and shiny as well as gently cleanse the hair without stripping your head's natural oils",https://www.amazon.com/dp/B00C4KUT5K,https://m.media-amazon.com/images/I/51eZE1CdfnL._SX300_SY300_QL70_ML2_.jpg,0,1,1,0,1,1
